 select Salary from employee_payroll where Name = "Usha";
+-----------+
| Salary    |
+-----------+
| 68780.000 |
+-----------+
1 row in set (0.00 sec)

mysql> select * from employee_payroll where Start_Date between cast("2018-01-01" as DATE) and DATE(now()) order by Start_Date;
+----+-----------+------------+------------+--------+--------------+---------+------------+-----------+------------+-------------+------------+---------+
| Id | Name      | Salary     | Start_Date | Gender | Phone_Number | Address | Department | Basic_Pay | Deductions | Taxable_Pay | Income_Tax | Net_Pay |
+----+-----------+------------+------------+--------+--------------+---------+------------+-----------+------------+-------------+------------+---------+
|  5 | Ravikiran |  72000.000 | 2018-05-22 | M      | NULL         | India   |            | NULL      | NULL       | NULL        | NULL       | NULL    |
|  6 | Preeti    |  67500.000 | 2019-11-12 | M      | NULL         | India   | Marketing  | NULL      | NULL       | NULL        | NULL       | NULL    |
|  1 | Preeti    | 300000.000 | 2021-04-12 | F      | NULL         | India   | Sales      | NULL      | NULL       | NULL        | NULL       | NULL    |
|  4 | Usha      |  68780.000 | 2022-06-27 | F      | NULL         | India   |            | NULL      | NULL       | NULL        | NULL       | NULL    |
|  2 | Sanjana   |  34000.000 | 2022-09-08 | F      | NULL         | India   |            | NULL      | NULL       | NULL        | NULL       | NULL    |
|  3 | Smriti    |  52300.000 | 2023-01-28 | F      | NULL         | India   |            | NULL      | NULL       | NULL        | NULL       | NULL    |
+----+-----------+------------+------------+--------+--------------+---------+------------+-----------+------------+-------------+------------+---------+
6 rows in set (0.00 sec)

mysql>  update employee_payroll set Gender ="M" where Name = "Ravikiran";
Query OK, 0 rows affected (0.00 sec)
Rows matched: 1  Changed: 0  Warnings: 0

mysql>  update employee_payroll set Gender ="F" where Id = 6;
Query OK, 1 row affected (0.01 sec)
Rows matched: 1  Changed: 1  Warnings: 0

mysql> select * from employee_payroll;
+----+-----------+------------+------------+--------+--------------+---------+------------+-----------+------------+-------------+------------+---------+
| Id | Name      | Salary     | Start_Date | Gender | Phone_Number | Address | Department | Basic_Pay | Deductions | Taxable_Pay | Income_Tax | Net_Pay |
+----+-----------+------------+------------+--------+--------------+---------+------------+-----------+------------+-------------+------------+---------+
|  1 | Preeti    | 300000.000 | 2021-04-12 | F      | NULL         | India   | Sales      | NULL      | NULL       | NULL        | NULL       | NULL    |
|  2 | Sanjana   |  34000.000 | 2022-09-08 | F      | NULL         | India   |            | NULL      | NULL       | NULL        | NULL       | NULL    |
|  3 | Smriti    |  52300.000 | 2023-01-28 | F      | NULL         | India   |            | NULL      | NULL       | NULL        | NULL       | NULL    |
|  4 | Usha      |  68780.000 | 2022-06-27 | F      | NULL         | India   |            | NULL      | NULL       | NULL        | NULL       | NULL    |
|  5 | Ravikiran |  72000.000 | 2018-05-22 | M      | NULL         | India   |            | NULL      | NULL       | NULL        | NULL       | NULL    |
|  6 | Preeti    |  67500.000 | 2019-11-12 | F      | NULL         | India   | Marketing  | NULL      | NULL       | NULL        | NULL       | NULL    |
+----+-----------+------------+------------+--------+--------------+---------+------------+-----------+------------+-------------+------------+---------+
6 rows in set (0.00 sec)
